{"schema":"ces.delivery_authorization.v1","status":"invalid_input","exit_code":4,"reason_code":"DELIVERY_AUTHORIZATION_SYNTHETIC_DENY","authorization_receipt_id":null,"authorization":null,"delivery_state":"NO_DELIVERY_OR_PUBLICATION","effects":{"external_network_requested":false,"recipient_contacted":false,"message_sent":false,"delivery_accepted":false,"delivered":false,"published":false,"issue_or_pr_created_or_modified":false,"git_or_business_files_written":false,"ces_records_written":false,"external_ai_invoked":false,"source_content_disclosed_in_preview":false,"recipient_identity_verified":false,"delivery_authorized":false}}
